{
  "schemaVersion": "1.0.0",
  "syncReportId": "SYNC-GRAPH-AInvil-Productization-2026-07-06",
  "generatedAt": "2026-07-06T11:28:06.280Z",
  "sourceFiles": [
    {
      "kind": "Production State Graph",
      "path": "state/production_state_graph.json",
      "used": true
    },
    {
      "kind": "Traceability View",
      "path": "reports/traceability_view.json",
      "used": true
    },
    {
      "kind": "Project Dashboard",
      "path": "reports/project_dashboard.json",
      "used": true
    },
    {
      "kind": "Validation Evidence",
      "path": "validation/evidence/EVID-top-down-collectible-latest-failed.json",
      "used": true
    }
  ],
  "graphSummary": {
    "graphId": "GRAPH-AInvil-Productization",
    "nodeCount": 104,
    "edgeCount": 122,
    "activeFeatureNodeId": "FEAT-DRC-PROC-RecoveryJob",
    "currentMilestoneNodeId": "MILESTONE-DRC-MVP-FirstPlayable"
  },
  "traceabilitySummary": {
    "rowCount": 40,
    "countsByStatus": {
      "Needs Technical Mapping": 16,
      "Complete": 1,
      "Needs Feature Spec": 14,
      "Needs Acceptance Criteria": 1,
      "Needs Implementation Task": 8
    },
    "missingLinkCount": 41,
    "proposedLinkCount": 91
  },
  "dashboardSummary": {
    "projectName": "AInvil Productization",
    "currentMilestone": {
      "nodeId": "MILESTONE-DRC-MVP-FirstPlayable",
      "title": "Dungeon Recovery Company first playable vertical slice",
      "status": "In Progress",
      "owner": "Orchestrator"
    },
    "activeFeature": {
      "nodeId": "FEAT-DRC-PROC-RecoveryJob",
      "title": "Procedural Recovery Job",
      "status": "Implemented",
      "owner": "GDD Agent"
    },
    "nextRecommendedAction": {
      "actionId": "NEXT-DRC-PROC-Validate",
      "title": "Run procedural recovery job E2E validation for seeds 1001, 2026, and 7777.",
      "owner": "Input Agent",
      "status": "Planned",
      "reason": "Procedural generation must prove deterministic layouts, reachable targets, recovery completion, and zero console errors before further gameplay expansion.",
      "referencesNodeId": "FEAT-DRC-PROC-RecoveryJob",
      "requiredValidationLevel": "Play Mode Verified"
    }
  },
  "driftFindings": [
    {
      "driftType": "TaskWithoutUnityTarget",
      "rowId": "TRACE-FEAT-E2E-HappyPath-001-REQ-E2E-001-TASK-E2E-001",
      "status": "Needs Technical Mapping",
      "missingLinks": [
        "UnityTarget"
      ],
      "nextAction": "Resolve missing UnityTarget."
    },
    {
      "driftType": "TaskWithoutUnityTarget",
      "rowId": "TRACE-FEAT-E2E-HappyPath-001-REQ-E2E-002-TASK-E2E-002-AC-E2E-001",
      "status": "Needs Technical Mapping",
      "missingLinks": [
        "UnityTarget"
      ],
      "nextAction": "Resolve missing UnityTarget."
    },
    {
      "driftType": "TaskWithoutUnityTarget",
      "rowId": "TRACE-FEAT-E2E-HappyPath-001-REQ-E2E-002-TASK-E2E-003-AC-E2E-001",
      "status": "Needs Technical Mapping",
      "missingLinks": [
        "UnityTarget"
      ],
      "nextAction": "Resolve missing UnityTarget."
    },
    {
      "driftType": "TraceabilityGap",
      "rowId": "TRACE-FEAT-DRC-MVP-FirstRecoveryJob-REQ-DRC-MVP-001-TASK-DRC-MVP-001-UNITY-DRC-FirstRecoveryJob-Scene-AC-DRC-MVP-001",
      "status": "Needs Feature Spec",
      "missingLinks": [
        "FeatureSpec"
      ],
      "nextAction": "Resolve missing FeatureSpec."
    },
    {
      "driftType": "TraceabilityGap",
      "rowId": "TRACE-FEAT-DRC-MVP-FirstRecoveryJob-REQ-DRC-MVP-001-TASK-DRC-MVP-001-UNITY-DRC-FirstRecoveryJob-Scene-AC-DRC-MVP-002",
      "status": "Needs Feature Spec",
      "missingLinks": [
        "FeatureSpec"
      ],
      "nextAction": "Resolve missing FeatureSpec."
    },
    {
      "driftType": "TraceabilityGap",
      "rowId": "TRACE-FEAT-DRC-MVP-FirstRecoveryJob-REQ-DRC-MVP-001-TASK-DRC-MVP-001-UNITY-DRC-FirstRecoveryJob-Scene-AC-DRC-MVP-003",
      "status": "Needs Feature Spec",
      "missingLinks": [
        "FeatureSpec"
      ],
      "nextAction": "Resolve missing FeatureSpec."
    },
    {
      "driftType": "TraceabilityGap",
      "rowId": "TRACE-FEAT-DRC-MVP-FirstRecoveryJob-REQ-DRC-MVP-001-TASK-DRC-MVP-001-UNITY-DRC-FirstPlayable-Scripts-AC-DRC-MVP-001",
      "status": "Needs Feature Spec",
      "missingLinks": [
        "FeatureSpec"
      ],
      "nextAction": "Resolve missing FeatureSpec."
    },
    {
      "driftType": "TraceabilityGap",
      "rowId": "TRACE-FEAT-DRC-MVP-FirstRecoveryJob-REQ-DRC-MVP-001-TASK-DRC-MVP-001-UNITY-DRC-FirstPlayable-Scripts-AC-DRC-MVP-002",
      "status": "Needs Feature Spec",
      "missingLinks": [
        "FeatureSpec"
      ],
      "nextAction": "Resolve missing FeatureSpec."
    },
    {
      "driftType": "TraceabilityGap",
      "rowId": "TRACE-FEAT-DRC-MVP-FirstRecoveryJob-REQ-DRC-MVP-001-TASK-DRC-MVP-001-UNITY-DRC-FirstPlayable-Scripts-AC-DRC-MVP-003",
      "status": "Needs Feature Spec",
      "missingLinks": [
        "FeatureSpec"
      ],
      "nextAction": "Resolve missing FeatureSpec."
    },
    {
      "driftType": "TaskWithoutUnityTarget",
      "rowId": "TRACE-FEAT-DRC-MVP-FirstRecoveryJob-REQ-DRC-MVP-001-TASK-DRC-MVP-002-AC-DRC-MVP-001",
      "status": "Needs Technical Mapping",
      "missingLinks": [
        "UnityTarget"
      ],
      "nextAction": "Resolve missing UnityTarget."
    },
    {
      "driftType": "TaskWithoutUnityTarget",
      "rowId": "TRACE-FEAT-DRC-MVP-FirstRecoveryJob-REQ-DRC-MVP-001-TASK-DRC-MVP-003-AC-DRC-MVP-001",
      "status": "Needs Technical Mapping",
      "missingLinks": [
        "UnityTarget"
      ],
      "nextAction": "Resolve missing UnityTarget."
    },
    {
      "driftType": "TraceabilityGap",
      "rowId": "TRACE-FEAT-DRC-PROC-RecoveryJob-REQ-DRC-PROC-001-TASK-DRC-PROC-001-UNITY-DRC-ProceduralRecoveryJob-Scene-AC-DRC-PROC-001",
      "status": "Needs Feature Spec",
      "missingLinks": [
        "FeatureSpec"
      ],
      "nextAction": "Resolve missing FeatureSpec."
    },
    {
      "driftType": "TraceabilityGap",
      "rowId": "TRACE-FEAT-DRC-PROC-RecoveryJob-REQ-DRC-PROC-001-TASK-DRC-PROC-001-UNITY-DRC-ProceduralRecoveryJob-Scene-AC-DRC-PROC-002",
      "status": "Needs Feature Spec",
      "missingLinks": [
        "FeatureSpec"
      ],
      "nextAction": "Resolve missing FeatureSpec."
    },
    {
      "driftType": "TraceabilityGap",
      "rowId": "TRACE-FEAT-DRC-PROC-RecoveryJob-REQ-DRC-PROC-001-TASK-DRC-PROC-001-UNITY-DRC-ProceduralRecoveryJob-Scene-AC-DRC-PROC-003",
      "status": "Needs Feature Spec",
      "missingLinks": [
        "FeatureSpec"
      ],
      "nextAction": "Resolve missing FeatureSpec."
    },
    {
      "driftType": "TraceabilityGap",
      "rowId": "TRACE-FEAT-DRC-PROC-RecoveryJob-REQ-DRC-PROC-001-TASK-DRC-PROC-001-UNITY-DRC-ProceduralRecoveryJob-Scene-AC-DRC-PROC-004",
      "status": "Needs Feature Spec",
      "missingLinks": [
        "FeatureSpec"
      ],
      "nextAction": "Resolve missing FeatureSpec."
    },
    {
      "driftType": "TraceabilityGap",
      "rowId": "TRACE-FEAT-DRC-PROC-RecoveryJob-REQ-DRC-PROC-001-TASK-DRC-PROC-001-UNITY-DRC-ProceduralRecoveryJob-Scene-AC-DRC-PROC-005",
      "status": "Needs Feature Spec",
      "missingLinks": [
        "FeatureSpec"
      ],
      "nextAction": "Resolve missing FeatureSpec."
    },
    {
      "driftType": "TraceabilityGap",
      "rowId": "TRACE-FEAT-DRC-PROC-RecoveryJob-REQ-DRC-PROC-001-TASK-DRC-PROC-001-UNITY-DRC-ProceduralRecoveryJob-Scene-AC-DRC-PROC-006",
      "status": "Needs Feature Spec",
      "missingLinks": [
        "FeatureSpec"
      ],
      "nextAction": "Resolve missing FeatureSpec."
    },
    {
      "driftType": "TraceabilityGap",
      "rowId": "TRACE-FEAT-DRC-PROC-RecoveryJob-REQ-DRC-PROC-001-TASK-DRC-PROC-001-UNITY-DRC-ProceduralRecoveryJob-Scene-AC-DRC-PROC-007",
      "status": "Needs Feature Spec",
      "missingLinks": [
        "FeatureSpec"
      ],
      "nextAction": "Resolve missing FeatureSpec."
    },
    {
      "driftType": "TraceabilityGap",
      "rowId": "TRACE-FEAT-DRC-PROC-RecoveryJob-REQ-DRC-PROC-001-TASK-DRC-PROC-001-UNITY-DRC-ProceduralRecoveryJob-Scene-AC-DRC-PROC-008",
      "status": "Needs Feature Spec",
      "missingLinks": [
        "FeatureSpec"
      ],
      "nextAction": "Resolve missing FeatureSpec."
    },
    {
      "driftType": "NeedsAcceptanceCriteria",
      "rowId": "TRACE-FEAT-DRC-PROC-RecoveryJob-REQ-DRC-PROC-002-TASK-DRC-PROC-002-UNITY-DRC-ProceduralRecoveryJob-Scripts",
      "status": "Needs Acceptance Criteria",
      "missingLinks": [
        "FeatureSpec",
        "AcceptanceCriterion",
        "ValidationEvidence"
      ],
      "nextAction": "Resolve missing FeatureSpec."
    },
    {
      "driftType": "RequirementWithoutTask",
      "rowId": "TRACE-FEAT-DRC-PROC-RecoveryJob-REQ-DRC-PROC-003",
      "status": "Needs Implementation Task",
      "missingLinks": [
        "ImplementationTask"
      ],
      "nextAction": "Resolve missing ImplementationTask."
    },
    {
      "driftType": "RequirementWithoutTask",
      "rowId": "TRACE-FEAT-DRC-PROC-RecoveryJob-REQ-DRC-PROC-004",
      "status": "Needs Implementation Task",
      "missingLinks": [
        "ImplementationTask"
      ],
      "nextAction": "Resolve missing ImplementationTask."
    },
    {
      "driftType": "TaskWithoutUnityTarget",
      "rowId": "TRACE-FEAT-DRC-PROC-RecoveryJob-REQ-DRC-PROC-005-TASK-DRC-PROC-005",
      "status": "Needs Technical Mapping",
      "missingLinks": [
        "UnityTarget"
      ],
      "nextAction": "Resolve missing UnityTarget."
    },
    {
      "driftType": "TaskWithoutUnityTarget",
      "rowId": "TRACE-FEAT-DRC-PROC-RecoveryJob-REQ-DRC-PROC-006-TASK-DRC-PROC-003",
      "status": "Needs Technical Mapping",
      "missingLinks": [
        "UnityTarget"
      ],
      "nextAction": "Resolve missing UnityTarget."
    },
    {
      "driftType": "TaskWithoutUnityTarget",